[
  {
    "id": 1,
    "slug": "abu-salim",
    "name_ar": "أبوسليم",
    "name_en": "Abu Salim",
    "type": "municipality",
    "latitude": 32.849547,
    "longitude": 13.171221,
    "coordinate_source": "openstreetmap-geofabrik",
    "coordinate_source_id": "n1411070218",
    "point_type": "osm_named_place"
  },
  {
    "id": 2,
    "slug": "ubari",
    "name_ar": "أوباري",
    "name_en": "Ubari",
    "type": "municipality",
    "latitude": 26.590939,
    "longitude": 12.769566,
    "coordinate_source": "openstreetmap-geofabrik",
    "coordinate_source_id": "n260715532",
    "point_type": "osm_named_place"
  },
  {
    "id": 3,
    "slug": "awjila",
    "name_ar": "أوجلة",
    "name_en": "Awjila",
    "type": "municipality",
    "latitude": 29.140278,
    "longitude": 21.2975,
    "coordinate_source": "openstreetmap-geofabrik",
    "coordinate_source_id": "n1565509942",
    "point_type": "osm_named_place"
  },
  {
    "id": 4,
    "slug": "jakharrad",
    "name_ar": "اجخرة",
    "name_en": "Jakharrad",
    "type": "municipality",
    "latitude": 29.296253,
    "longitude": 21.649898,
    "coordinate_source": "openstreetmap-geofabrik",
    "coordinate_source_id": "n1565511190",
    "point_type": "osm_named_place"
  },
  {
    "id": 5,
    "slug": "ajdabiya",
    "name_ar": "إجدابيا",
    "name_en": "Ajdabiya",
    "type": "municipality",
    "latitude": 30.754962,
    "longitude": 20.223358,
    "coordinate_source": "openstreetmap-geofabrik",
    "coordinate_source_id": "n277399765",
    "point_type": "osm_named_place"
  },
  {
    "id": 6,
    "slug": "idri-al-shati",
    "name_ar": "إدري الشاطئ",
    "name_en": "Idri Al Shati",
    "type": "municipality",
    "latitude": null,
    "longitude": null,
    "coordinate_source": null,
    "coordinate_source_id": null,
    "point_type": null
  },
  {
    "id": 7,
    "slug": "sbea",
    "name_ar": "اسبيعة",
    "name_en": "Sbea",
    "type": "municipality",
    "latitude": null,
    "longitude": null,
    "coordinate_source": null,
    "coordinate_source_id": null,
    "point_type": null
  },
  {
    "id": 8,
    "slug": "al-abraq",
    "name_ar": "الأبرق",
    "name_en": "Al Abraq",
    "type": "municipality",
    "latitude": 32.786528,
    "longitude": 21.997782,
    "coordinate_source": "openstreetmap-geofabrik",
    "coordinate_source_id": "n1565508919",
    "point_type": "osm_named_place"
  },
  {
    "id": 9,
    "slug": "al-abyar",
    "name_ar": "الأبيار",
    "name_en": "Al Abyar",
    "type": "municipality",
    "latitude": 32.189645,
    "longitude": 20.594509,
    "coordinate_source": "openstreetmap-geofabrik",
    "coordinate_source_id": "n1565508929",
    "point_type": "osm_named_place"
  },
  {
    "id": 10,
    "slug": "al-asabaa",
    "name_ar": "الأصابعة",
    "name_en": "Al Asabaa",
    "type": "municipality",
    "latitude": 32.03519,
    "longitude": 12.871946,
    "coordinate_source": "openstreetmap-geofabrik",
    "coordinate_source_id": "n1565508963",
    "point_type": "osm_named_place"
  },
  {
    "id": 11,
    "slug": "al-bardi",
    "name_ar": "البردي",
    "name_en": "Al Bardi",
    "type": "municipality",
    "latitude": 31.75601,
    "longitude": 25.0853,
    "coordinate_source": "geonames",
    "coordinate_source_id": "80509",
    "point_type": "named_place"
  },
  {
    "id": 12,
    "slug": "brega",
    "name_ar": "البريقة",
    "name_en": "Brega",
    "type": "municipality",
    "latitude": 30.40624,
    "longitude": 19.57386,
    "coordinate_source": "geonames",
    "coordinate_source_id": "2215210",
    "point_type": "named_place"
  },
  {
    "id": 13,
    "slug": "al-bayda",
    "name_ar": "البيضاء",
    "name_en": "Al Bayda",
    "type": "municipality",
    "latitude": 32.760953,
    "longitude": 21.757717,
    "coordinate_source": "openstreetmap-geofabrik",
    "coordinate_source_id": "n288491858",
    "point_type": "osm_named_place"
  },
  {
    "id": 14,
    "slug": "al-jufra",
    "name_ar": "الجفرة",
    "name_en": "Al Jufra",
    "type": "municipality",
    "latitude": 28.005572,
    "longitude": 16.743029,
    "coordinate_source": "openstreetmap-geofabrik",
    "coordinate_source_id": "n1312442235",
    "point_type": "administrative_label_point"
  },
  {
    "id": 15,
    "slug": "al-jumayl",
    "name_ar": "الجميل",
    "name_en": "Al Jumayl",
    "type": "municipality",
    "latitude": 32.849715,
    "longitude": 12.057674,
    "coordinate_source": "openstreetmap-geofabrik",
    "coordinate_source_id": "n1169748259",
    "point_type": "osm_named_place"
  },
  {
    "id": 16,
    "slug": "al-haraba",
    "name_ar": "الحرابة",
    "name_en": "Al Haraba",
    "type": "municipality",
    "latitude": 31.777205,
    "longitude": 11.56717,
    "coordinate_source": "openstreetmap-geofabrik",
    "coordinate_source_id": "n1565509159",
    "point_type": "osm_named_place"
  },
  {
    "id": 17,
    "slug": "al-hawamid",
    "name_ar": "الحوامد",
    "name_en": "Al Hawamid",
    "type": "municipality",
    "latitude": 31.975496,
    "longitude": 11.162235,
    "coordinate_source": "openstreetmap-geofabrik",
    "coordinate_source_id": "n1246799070",
    "point_type": "osm_named_place"
  },
  {
    "id": 18,
    "slug": "khoms",
    "name_ar": "الخمس",
    "name_en": "Khoms",
    "type": "municipality",
    "latitude": 32.652183,
    "longitude": 14.26801,
    "coordinate_source": "openstreetmap-geofabrik",
    "coordinate_source_id": "n277399357",
    "point_type": "osm_named_place"
  },
  {
    "id": 19,
    "slug": "al-rajban",
    "name_ar": "الرجبان",
    "name_en": "Al Rajban",
    "type": "municipality",
    "latitude": 31.94113,
    "longitude": 12.090819,
    "coordinate_source": "openstreetmap-geofabrik",
    "coordinate_source_id": "n1157457006",
    "point_type": "osm_named_place"
  },
  {
    "id": 20,
    "slug": "al-rhaibat",
    "name_ar": "الرحيبات",
    "name_en": "Al Rhaibat",
    "type": "municipality",
    "latitude": 31.84637,
    "longitude": 11.8436,
    "coordinate_source": "geonames",
    "coordinate_source_id": "12687312",
    "point_type": "named_place"
  },
  {
    "id": 21,
    "slug": "al-rayayna",
    "name_ar": "الرياينة",
    "name_en": "Al Rayayna",
    "type": "municipality",
    "latitude": 31.994115,
    "longitude": 12.344984,
    "coordinate_source": "openstreetmap-geofabrik",
    "coordinate_source_id": "n1281223987",
    "point_type": "osm_named_place"
  },
  {
    "id": 22,
    "slug": "zawiya",
    "name_ar": "الزاوية",
    "name_en": "Zawiya",
    "type": "municipality",
    "latitude": 32.378703,
    "longitude": 12.521493,
    "coordinate_source": "openstreetmap-geofabrik",
    "coordinate_source_id": "n1312442219",
    "point_type": "administrative_label_point"
  },
  {
    "id": 23,
    "slug": "zawiya-south",
    "name_ar": "الزاوية الجنوب",
    "name_en": "Zawiya South",
    "type": "municipality",
    "latitude": null,
    "longitude": null,
    "coordinate_source": null,
    "coordinate_source_id": null,
    "point_type": null
  },
  {
    "id": 24,
    "slug": "zawiya-west",
    "name_ar": "الزاوية الغرب",
    "name_en": "Zawiya West",
    "type": "municipality",
    "latitude": null,
    "longitude": null,
    "coordinate_source": null,
    "coordinate_source_id": null,
    "point_type": null
  },
  {
    "id": 25,
    "slug": "zintan",
    "name_ar": "الزنتان",
    "name_en": "Zintan",
    "type": "municipality",
    "latitude": 31.927361,
    "longitude": 12.251507,
    "coordinate_source": "openstreetmap-geofabrik",
    "coordinate_source_id": "n14148081465",
    "point_type": "osm_named_place"
  },
  {
    "id": 26,
    "slug": "al-zahra",
    "name_ar": "الزهراء",
    "name_en": "Al Zahra",
    "type": "municipality",
    "latitude": null,
    "longitude": null,
    "coordinate_source": null,
    "coordinate_source_id": null,
    "point_type": null
  },
  {
    "id": 27,
    "slug": "zuwetina-sultan",
    "name_ar": "الزويتينة سلطان",
    "name_en": "Zuwetina Sultan",
    "type": "municipality",
    "latitude": null,
    "longitude": null,
    "coordinate_source": null,
    "coordinate_source_id": null,
    "point_type": null
  },
  {
    "id": 28,
    "slug": "al-sayeh",
    "name_ar": "السائح",
    "name_en": "Al Sayeh",
    "type": "municipality",
    "latitude": null,
    "longitude": null,
    "coordinate_source": null,
    "coordinate_source_id": null,
    "point_type": null
  },
  {
    "id": 29,
    "slug": "al-sharqiya",
    "name_ar": "الشرقية",
    "name_en": "Al Sharqiya",
    "type": "municipality",
    "latitude": null,
    "longitude": null,
    "coordinate_source": null,
    "coordinate_source_id": null,
    "point_type": null
  },
  {
    "id": 30,
    "slug": "al-shuqayqa",
    "name_ar": "الشقيقة",
    "name_en": "Al Shuqayqa",
    "type": "municipality",
    "latitude": 31.63974,
    "longitude": 12.80686,
    "coordinate_source": "geonames",
    "coordinate_source_id": "11739598",
    "point_type": "named_place"
  },
  {
    "id": 31,
    "slug": "al-shwerif",
    "name_ar": "الشويرف",
    "name_en": "Al Shwerif",
    "type": "municipality",
    "latitude": 29.98238,
    "longitude": 14.259466,
    "coordinate_source": "openstreetmap-geofabrik",
    "coordinate_source_id": "n1193620130",
    "point_type": "osm_named_place"
  },
  {
    "id": 32,
    "slug": "al-ameriya",
    "name_ar": "العامرية",
    "name_en": "Al Ameriya",
    "type": "municipality",
    "latitude": null,
    "longitude": null,
    "coordinate_source": null,
    "coordinate_source_id": null,
    "point_type": null
  },
  {
    "id": 33,
    "slug": "al-ajaylat",
    "name_ar": "العجيلات",
    "name_en": "Al Ajaylat",
    "type": "municipality",
    "latitude": 32.757758,
    "longitude": 12.37738,
    "coordinate_source": "openstreetmap-geofabrik",
    "coordinate_source_id": "n1169743113",
    "point_type": "osm_named_place"
  },
  {
    "id": 34,
    "slug": "al-urban",
    "name_ar": "العربان",
    "name_en": "Al Urban",
    "type": "municipality",